<?xml version="1.0" encoding="UTF-8" ?>
<xs:schema
    xmlns:xs="http://www.w3.org/2001/XMLSchema">
    <xs:element name="company">
        <xs:complexType>
            <xs:sequence>
                <xs:element name="employee" maxOccurs="unbounded">
                    <xs:complexType>
                        <xs:sequence>
                            <xs:element name="Emp-ID" type="xs:string"/>
                            <xs:element name="Emp-name" type="xs:string"/>
                            <xs:element name="Emp-age" type="xs:integer"/>
                            <xs:element name="Emp-salary" type="xs:integer"/>
                            <xs:simpleType>
                                <xs:restriction base="xs:integer">
                                    <xs:minInclusive value="50000"/>
                                    <xs:maxInclusive value="200000"/>
                                </xs:restriction>
                            </xs:simpleType>
                            <xs:element name="Emp-emailid" type="xs:string"/>
                            <xs:element name="Emp-Phonenum" type="xs:integer"/>
                            <xs:simpleType>
                                <xs:restriction base="xs:integer">
                                    <xs:length value="10"/>
                                </xs:restriction>
                            </xs:simpleType>
                            <xs:element name="Emp-designation" type="xs:string"/></xs:element>
                    </xs:sequence>
                </xs:complexType>
            </xs:element>
        </xs:sequence>
    </xs:complexType>
</xs:element>
</xs:schema>