/*HARSHA 2047229*/
<?xml version="1.0" encoding="UTF-8"?>
<?xml-stylesheet type="text/xsl" href="employee.xsl"?>
<company xmlns:xsi="http://www.w3.org/2001/XMLSchema-instance"
      xsi:noNamespaceSchemaLocation="employee.xsd">
	
	<employee>
	<Emp-ID> 201</Emp-ID>
		<Emp-name> HARSHIT</Emp-name>
		<Emp-age> 26</Emp-age> 
		<Emp-salary>40000 </Emp-salary>
		<Emp-emailid>harshit12@gmail.com</Emp-emailid>
		<Emp-Phonenum>9208734902</Emp-Phonenum>
		<Emp-designation> Junior manager</Emp-designation>
	</employee>
	<employee>
	<Emp-ID> 202</Emp-ID>
		<Emp-name> Akash</Emp-name>
		<Emp-age> 49</Emp-age> 
		<Emp-salary>45000 </Emp-salary>
		<Emp-emailid>Akash34@gmail.com</Emp-emailid>
		<Emp-Phonenum>9208784102</Emp-Phonenum>
		<Emp-designation> manager</Emp-designation>
	</employee>
	<employee>
	<Emp-ID> 203</Emp-ID>
		<Emp-name> Johnny</Emp-name>
		<Emp-age> 43</Emp-age> 
		<Emp-salary>55000 </Emp-salary>
		<Emp-emailid>johnny12@gmail.com</Emp-emailid>
		<Emp-Phonenum>9208964902</Emp-Phonenum>
		<Emp-designation>intern </Emp-designation>
	</employee>
	<employee>
	<Emp-ID> 204</Emp-ID>
		<Emp-name> Rahul</Emp-name>
		<Emp-age> 56</Emp-age> 
		<Emp-salary>60000</Emp-salary>
		<Emp-emailid>rahul1902@gmail.com</Emp-emailid>
		<Emp-Phonenum>9208734902</Emp-Phonenum>
		<Emp-designation> CEO</Emp-designation>
	</employee>
	
	
	
</company>